<?xml version="1.0" encoding="UTF-8"?>
<xs:schema xmlns:xs="http://www.w3.org/2001/XMLSchema"
    xmlns="http://www.toomanysecrets.com/centralnasema"
    targetNamespace="http://www.toomanysecrets.com/centralnasema">

    <xs:element name="centralnaSema">
        <xs:complexType>
            <xs:sequence>
                <xs:element maxOccurs="unbounded" name="banke">
                    <xs:complexType>
                        <xs:sequence>
                            <xs:element name="naziv">
                                <xs:simpleType>
                                    <xs:restriction base="xs:string">
                                        <xs:maxLength value="255"/>
                                    </xs:restriction>
                                </xs:simpleType>
                            </xs:element>
                            <xs:element name="swift">
                                <xs:simpleType>
                                    <xs:restriction base="xs:string">
                                        <xs:pattern
                                            value="[A-Z]{4}[A-Z]{2}[0-9A-Z]{2}([0-9A-Z]{3})?"/>
                                    </xs:restriction>
                                </xs:simpleType>
                            </xs:element>
                            <xs:element name="stanje">
                                <xs:simpleType>
                                    <xs:restriction base="xs:decimal">
                                        <xs:totalDigits value="15"/>
                                        <xs:fractionDigits value="2"/>
                                    </xs:restriction>
                                </xs:simpleType>
                            </xs:element>
                            <xs:element name="racun">
                                <xs:simpleType>
                                    <xs:restriction base="xs:string">
                                        <xs:length value="18"/>
                                    </xs:restriction>
                                </xs:simpleType>
                            </xs:element>
                        </xs:sequence>
                    </xs:complexType>
                </xs:element>
                <xs:element minOccurs="0" name="brojacPoslednjePoslateNotifikacije" type="xs:int"/>
                <xs:element minOccurs="0" name="brojacPoslednjegPoslatogMTNaloga" type="xs:int"/>
                <xs:element minOccurs="0" name="brojacPoslednjegPrimljenogMTNaloga">
                    <xs:complexType>
                        <xs:sequence maxOccurs="unbounded" minOccurs="0">
                            <xs:element maxOccurs="1" minOccurs="1" name="banka">
                                <xs:complexType>
                                    <xs:sequence>
                                        <xs:element name="nazivBanke">
                                            <xs:simpleType>
                                                <xs:restriction base="xs:string">
                                                  <xs:maxLength value="255"/>
                                                </xs:restriction>
                                            </xs:simpleType>
                                        </xs:element>
                                        <xs:element name="brojac" type="xs:int"/>
                                        <xs:element name="timestamp" type="xs:string"/>
                                    </xs:sequence>
                                </xs:complexType>
                            </xs:element>
                        </xs:sequence>
                    </xs:complexType>
                </xs:element>
            </xs:sequence>
        </xs:complexType>
    </xs:element>
</xs:schema>
