<?xml version="1.0" encoding="UTF-8"?>
<ns1:centralnaSema xmlns:ns1="http://www.toomanysecrets.com/centralnasema"
 xmlns:xsi="http://www.w3.org/2001/XMLSchema-instance"
 xsi:schemaLocation="http://www.toomanysecrets.com/centralnasema file:/C:/Users/Milan/Documents/GitHub/TooManySecrets/ProjekatSaBazom/WEB-INF/shema/centralnaSema.xsd">
    <banke>
        <naziv>naziv0</naziv>
        <swift>AAAAAA00</swift>
        <stanje>0.00</stanje>
        <racun>racun1111111111111</racun>
    </banke>
    <banke>
        <naziv>naziv1</naziv>
        <swift>AAAAAA00</swift>
        <stanje>0.00</stanje>
        <racun>racun3333333333333</racun>
    </banke>
    <brojacPoslednjePoslateNotifikacije>0</brojacPoslednjePoslateNotifikacije>
    <brojacPoslednjegPoslatogMTNaloga>0</brojacPoslednjegPoslatogMTNaloga>
    <brojacPoslednjegPrimljenogMTNaloga>
        <banka>
            <nazivBanke>nazivBanke0</nazivBanke>
            <brojac>0</brojac>
            <timestamp>timestamp0</timestamp>
        </banka>
        <banka>
            <nazivBanke>nazivBanke1</nazivBanke>
            <brojac>0</brojac>
            <timestamp>timestamp1</timestamp>
        </banka>
    </brojacPoslednjegPrimljenogMTNaloga>
</ns1:centralnaSema>
